1|agil1|förstå vad agila metoder är och hur de skiljer sig från andra projektmodeller/-metoder inom systemutveckling
2|agil1|ha insikt i de största agila metoderna på marknaden samt fördjupad insikt och kunskap om Scrum
3|agil1|förstå hur krav och kravändringar hanteras med agila metoder
4|agil1|förstå rollfördelningen i ett agilt projekt
5|agil1|förstå hur man man säkerställer kvalitet genom agila metoder
6|agil1|kunna delta i ett teamet som använder agila metoder i ett systemutvecklingsprojekt
7|agil1|kunna delta i löpande utvärdering och förbättring av agila projekt
8|agil1|kunna arbeta testdrivet i ett agilt projekt
